{
  "$schema": "https://json-schema.org/draft/2020-12/schema",
  "$id": "https://hardwaretest.local/program.schema.json",
  "title": "HardwareTest program sidecar",
  "description": "Session, DUT, and Typst report policy beside a locked .TapPlan. Instrument requirements belong in .TapPackage Dependencies, not here.",
  "type": "object",
  "additionalProperties": false,
  "properties": {
    "$schema": {
      "type": "string",
      "description": "Optional pointer to this schema for editor intellisense."
    },
    "displayName": { "type": "string" },
    "dutFamily": { "type": "string" },
    "requireSerial": { "type": "boolean" },
    "requirePartNumber": { "type": "boolean" },
    "requireRevision": { "type": "boolean" },
    "requireOperator": { "type": "boolean" },
    "reportKinds": {
      "type": "array",
      "minItems": 1,
      "items": { "type": "string", "minLength": 1 },
      "description": "Typst PDFs to generate after a run. status and certification are shipped; additional ids are stored for this workspace."
    },
    "defaultReportKind": {
      "type": "string",
      "minLength": 1,
      "description": "Kind Results opens on double-click. Must be listed in reportKinds."
    },
    "selectionIncludesCleanup": {
      "type": "boolean",
      "description": "When false, Run Selected excludes SafeShutdownStep."
    },
    "programKind": {
      "type": "string",
      "minLength": 1,
      "description": "dut (default) is a unit program. stationHealth is a bench cal / health program. Additional ids are stored for this workspace."
    },
    "requireStationHealth": {
      "type": "boolean",
      "description": "When true on a DUT sidecar, evaluate the station-health gate before Run (Area 5)."
    },
    "stationHealthMaxAgeHours": {
      "type": "number",
      "description": "DUT freshness window in hours when requireStationHealth is true."
    },
    "stationHealthGate": {
      "enum": ["warn", "block"],
      "description": "DUT gate level when requireStationHealth is true. Default warn."
    },
    "stationHealthProfileId": {
      "type": "string",
      "description": "Store key under {DataDirectory}/station-health/{id}.json. Default default."
    }
  }
}
